{
  "apiVersion": "aok/v1alpha1",
  "kind": "PlanRevision",
  "metadata": {
    "id": "exploration-plan-revision-1",
    "version": "0.1.0",
    "description": "Illustrative proposal fixture; no execution or integration implied.",
    "name": "Exploration Plan Revision 1"
  },
  "trigger": "Illustrative future discovery of an additional package.",
  "evidence": [],
  "changes": [
    {
      "stepId": "inspect",
      "operation": "modify",
      "reason": "Expand bounded inventory to include the newly found package."
    }
  ],
  "preservedEvidence": [],
  "invalidatedEvidence": [],
  "authorizationRef": null,
  "state": "proposed",
  "beforePlan": {
    "kind": "PlanDefinition",
    "id": "exploration-plan",
    "version": "0.1.0"
  },
  "afterPlan": {
    "kind": "PlanDefinition",
    "id": "exploration-plan",
    "version": "0.1.0"
  },
  "predecessor": null,
  "ordinal": 1
}
